{
  "manifest_version": "0.1",
  "validation_cell_id": "phase6-cell",
  "model_hash": "aaaaaaaaaaaaaaaaaaaaaaaaaaaaaaaaaaaaaaaaaaaaaaaaaaaaaaaaaaaaaaaa",
  "quantization_format": "Q4_K_M",
  "quant_artifact_sha256": "bbbbbbbbbbbbbbbbbbbbbbbbbbbbbbbbbbbbbbbbbbbbbbbbbbbbbbbbbbbbbbbb",
  "context_tokens": 2048,
  "batch_size": 1,
  "prompt_fixture_hash": "cccccccccccccccccccccccccccccccccccccccccccccccccccccccccccccccc",
  "backend": "llama.cpp",
  "os": "windows",
  "gpu_name": "gpu",
  "driver_mode": "wddm",
  "cuda_driver_version": 13030,
  "cuda_runtime_version": 13030,
  "vram_tier_gib": 8,
  "hard_cap_bytes": 8589934592,
  "op_type": "matmul",
  "sequence_phase": "decode",
  "kernel_backend": "prisminfer-cuda",
  "kernel_name": "q4-decode-gemv",
  "kernel_version": "2",
  "baseline_backend": "llama.cpp",
  "baseline_manifest_hash": "dddddddddddddddddddddddddddddddddddddddddddddddddddddddddddddddd",
  "correctness_fixture_hash": "eeeeeeeeeeeeeeeeeeeeeeeeeeeeeeeeeeeeeeeeeeeeeeeeeeeeeeeeeeeeeeee",
  "quality_fixture_hash": "ffffffffffffffffffffffffffffffffffffffffffffffffffffffffffffffff",
  "full_dequant_materialized": false,
  "workspace_peak_bytes": 2048,
  "device_resident_bytes": 0,
  "host_commit_peak_bytes": 0,
  "unknown_owned_bytes": 0,
  "ttft_ms": 0.0,
  "prefill_ms": 0.0,
  "decode_tokens_per_second": 0.0,
  "request_tail_ms": 0.0,
  "speedup_ratio": 0.0,
  "compression_status": "none",
  "quality_gate_id": "phase6-retrieval-gate",
  "cap_certification_status": "rejected",
  "run_outcome": "aborted",
  "supervisor_status": "aborted",
  "admission_status": "aborted",
  "requested_execution_path": "prisminfer-candidate",
  "actual_execution_path": "upstream-fallback",
  "failure_reason": "watchdog_timeout",
  "raw_trial_count": 0,
  "raw_trial_sha256": "",
  "failure_record_sha256": "9999999999999999999999999999999999999999999999999999999999999999",
  "claim_status": "rejected"
}
